"Title","Author_URL","Author_Name","App_Version","Rating","Review","Date"
"Couldn’t even log in for internet banking!","https://itunes.apple.com/sg/reviews/id48820368","KenjiTakeshiro","7.0.8","1","This app is full of bug. I am already registered for mobile banking and has an account but I just could not log in. I have internet connection and yet app kept showing error messages of me not connected to the internet and hence unable to log in. Load of rubbish. Get your team right. Banking services cannot be so unstable.",2018-07-07 05:34:29
"Can not login","https://itunes.apple.com/sg/reviews/id102943379","YuiMegumi","7.0.8","1","Anyone have similar problem not able to log in...",2018-07-05 06:23:32
"Anybody able to Login?","https://itunes.apple.com/sg/reviews/id244950404","Prakash-sg","7.0.8","1","Trying to Login for past 15-20mins. After a while getting no internet connection error message!! Other Apps are working fine!",2018-07-03 13:48:27
"Cry me a river","https://itunes.apple.com/sg/reviews/id221467371","Ohhreatnana","7.0.8","1","Was excited that your app finally got a cool interface but seriously, logging in was a total b***h. How come so laggy one.",2018-07-03 12:36:33
"Try harder","https://itunes.apple.com/sg/reviews/id301214605","Cc Scb User","7.0.8","1","You know, some people actually travel and they want to take their SCB credit cards with them with the hope that they can use it while they are overseas. But this app kills all hope because the bloody links in the app just don’t work no matter how hard you press on them. Even if you press your screen in, you’re out of luck! Fix it for God’s sake!!!!",2018-07-02 16:19:12
"Troublesome","https://itunes.apple.com/sg/reviews/id465711051","jendimariaprincessa11","7.0.8","1","The old version of this app is better and easy to use I don’t even have a problem with it. With this app. I can’t pay my bill because it kept on asking to register and authenticate or whatever. And it’s really time consuming. Pls do something about this. Thanks",2018-06-30 14:54:03
"Worst app","https://itunes.apple.com/sg/reviews/id391109223","Ki vagyok akadva","7.0.8","1","Never works",2018-06-27 16:16:44
"Completely Unusable!!","https://itunes.apple.com/sg/reviews/id121124316","Ktboy","7.0.8","1","The old SCB app was easy and smooth. Now, the new version is not even usable. I tried to re-download many times and subsequent to registering the PIN, the screen would just freeze, before crashing seconds later. As I tried to re-open the app, it would just crash again and no way to even enter the app unless I reinstall.

What good is a mobile banking app when you can’t even open it?! Fix this!!!",2018-06-27 14:35:28
"Buggy","https://itunes.apple.com/sg/reviews/id402355024","girlfromsingapore","7.0.8","1","Used to be good but new version keeps crashing so I can only use my internet banking on my laptop!",2018-06-27 04:24:27
"Font size","https://itunes.apple.com/sg/reviews/id104273143","teohky","7.0.8","1","Don’t like the latest version. It look nice and fancy but LACK practicality.

Font size too small. Try transfer money.... so difficult to click and get the right one because font size so small

Why update a well design apps to such a crappy new update? It ain broken don’t change it!",2018-06-25 06:32:42
"Crashes on startup","https://itunes.apple.com/sg/reviews/id216494090","Lily90222","7.0.8","1","SC MUST BE KIDDING! Did you ever test your app before publishing??",2018-06-23 14:51:52
"Auto shutdown","https://itunes.apple.com/sg/reviews/id397223450","Babyvenus21","7.0.8","1","Couldn’t open the app after the latest update. It will shutdown whenever I open it.",2018-06-21 14:36:43
"Terrible mobile app","https://itunes.apple.com/sg/reviews/id172524930","anonyomous8","7.0.8","1","There seems to be many bugs on this mobile app. Initially they force you to register for a mobile token but after several times of uninstalling and reinstalling of the mobile app, it still doesn’t work. Subsequently, there is a bug in that the OTP cannot be sent to the registered mobile number. Sad to say, I think the bank probably need a better system in place to avoid such problems which cause much inconvenience to their clients.",2018-06-21 03:14:59
"App still crashes after update","https://itunes.apple.com/sg/reviews/id179910579","Christophernest","7.0.8","1","That’s it. I’m deleting the app. Totally unusable. Every time I start up the app it crashes within 3-4 seconds. Maybe SC should spend some money at better developers.",2018-06-20 17:07:37
"App un-useable after update 1st Jun","https://itunes.apple.com/sg/reviews/id200675120","aezjnn","7.0.8","3","The two updates on 1st and 4 Jun rendered the app useable as there was no way to log in ... just seeing the videos and SCB logo. Wonder if developer tested app with required IOS version before release? 

Lastest update V7.08 resolved the issue ... finally. Good to see useful features which user can turn on/off .. would be nice to be able adjust font size and have faster loading and log in.",2018-06-15 05:30:33
"Cannot work!","https://itunes.apple.com/sg/reviews/id154059031","Heng1970","7.0.7","1","Lousy. After updated this latest version, I totally cannot use it! It kick me out after I open this app. I am so frustrated !",2018-06-14 16:45:55
"Stuck at login page","https://itunes.apple.com/sg/reviews/id151039246","DoomSkunk","7.0.7","2","Stuck at log in page. Cant even log in. App version, iphone version all up to date. Date and time on phone is auto synced, update as well.

Happened immediately after 4th june update",2018-06-12 05:34:13
"Force close","https://itunes.apple.com/sg/reviews/id371322073","Cheerful user","7.0.7","1","Basically useless",2018-06-11 17:01:29
"Faster and Easier","https://itunes.apple.com/sg/reviews/id155495056","Sapna T","7.0.7","5","Just paid my credit card bill with a few clicks - that’s so easy as opposed to logging onto the website - great convinience.",2018-06-11 09:51:43
"Lousy.","https://itunes.apple.com/sg/reviews/id173781482","yyyyy ?????","7.0.7","1","Wanted to activate my credit card for oversea usage. Inside the app under Services xxx, the link is not clickable. I called up phone banking, heard the message saying use mobile app to activate oversea usage?! Being directed here and there, cannot link me to credit card service and end up cannot activate my card. Fine, I use other card then. Citibank app just simple click to activate oversea usage. What is this app doing????",2018-06-10 22:57:34
"SCB app clashes","https://itunes.apple.com/sg/reviews/id585758208","SG SCB customer","7.0.7","1","Please update the SCB app (SG) to be compatible to iOS 11.4. The app can’t even start and keep clashing after the update of iOS 11.4. Kindly look into this matter. Thanks.",2018-06-10 14:20:17
"Latest version cannot even load","https://itunes.apple.com/sg/reviews/id272385280","ngoquoc0101","7.0.7","2","I just upgraded to the latest version and now it can't even load. So I can't approve internet login any more.",2018-06-06 14:41:40
"Innovative and user friendly app!!","https://itunes.apple.com/sg/reviews/id131451440","Sunshiny_day","7.0.7","5","Love this upgraded App!!",2018-06-06 06:29:09
"why lagged after update?","https://itunes.apple.com/sg/reviews/id222304283","Call me El niño","7.0.7","1","whats the point of updating when cant even logged in after updating,  this has caused do much inconvenience,  pls retify this problem ASAP! for now just give up!",2018-06-06 02:17:11
"Terrible","https://itunes.apple.com/sg/reviews/id289702887","Emmatwq","7.0.7","1","The app doesn't even load??",2018-06-05 16:07:30
"Stupid don't work in iOS9","https://itunes.apple.com/sg/reviews/id253985582","Be_ashketchup","7.0.5","1","How does it even pass into production without testing in ios9. Apple haven't banned ios9 yet, so you need to make changes and updates accordingly. Even iOS 8 is alive, I am stuck at launch video screen forever, it didn't even show me login screen. Resolve the issue as I am unable to use this app from last update. It was working when this first user interface came but not anymore. Because of this stupid, I can't even use website to make any transaction seems, they depend on each other which looks dependency. I need solution so I can turn off this feature.",2018-06-05 07:59:32
"Crash","https://itunes.apple.com/sg/reviews/id43110738","Seanzzt","7.0.5","1","The app keeps crashing when I try to open it",2018-06-04 06:07:05
"Worst enhancement","https://itunes.apple.com/sg/reviews/id818386418","Maomiji","7.0.5","1","Can't goto login interface after update new version, even can't check acc details via online banking because this stupid device token, no access to the interface then how to generate offline otp???",2018-06-04 00:31:12
"Not working after update","https://itunes.apple.com/sg/reviews/id139287023","Dr Dri","7.0.5","1","Not working after update. Uninstall, install back. Reboot still not working. Lousy",2018-06-03 15:06:20
"Latest app ver needs to be replaced","https://itunes.apple.com/sg/reviews/id214692925","Velcronara","7.0.5","1","The process of registering mobile phone number to replace token can never be completed after many tries

The main app UI is awkward. Once you click on the burger menu on top left to access other services, there’s a pop up asking if you’d like to access web pages and exit. And the options display looks very unprofessional , as if the work is still incomplete",2018-06-02 09:31:14
"No login UI","https://itunes.apple.com/sg/reviews/id193593794","SuperOld Customer","7.0.5","1","After latest update, the app totally cannot login with no login input on my iPhone 6+!!!",2018-06-02 09:17:22
"Exit immediately after I open the app","https://itunes.apple.com/sg/reviews/id817230235","Roger Sheng","7.0.5","1","Exit immediately after I open the app.",2018-06-02 09:02:34
"Can’t launch","https://itunes.apple.com/sg/reviews/id134240126","Tammie1280","7.0.5","1","App prompt me to register for mobile token. It hanged halfway while I was doing it. After that, I couldn’t even launch app for a couple fo days. Going to re download and see what happens.",2018-06-02 08:05:23
"Lousy app","https://itunes.apple.com/sg/reviews/id132145438","bebebaba","7.0.4","1","App keep closing by itself after recent update. Can u pls do something about it? It was working perfectly fine before the recent upgrade.",2018-06-02 07:26:48
"Can’t load after update...","https://itunes.apple.com/sg/reviews/id152950635","Dummmer","7.0.4","1","Unable to load the app after latest update... why??",2018-06-01 03:41:55
"Worst banking app and customer experience ever!!","https://itunes.apple.com/sg/reviews/id158120309","Jjd1231","7.0.4","1","Just opened my account when Bank transitioned to new ‘sc mobile key’ to replace security tokens. You need to click approve in the app to add new payees and other functions. It’s for extra security and the bank saves money by eliminating tokens.

This has been dysfunctional with error messages popping up in the app. ‘Known issue’ customer service said and its been ‘escalated’. It’s been 3 days!! Second time it’s happened with the second payee I’ve added in over a month. 

I can’t move money out of my own account!
I had an urgent payment missed and I suffer the consequences. It’s my worst customer experience ever!",2018-06-01 03:17:13
"Stupid update!!","https://itunes.apple.com/sg/reviews/id140228299","Bong06","7.0.4","1","Updated the apps and it cannot even load!! And I can't even login using browser as request to generate offline pin via mobile app!!! STUPID!!!! Test before roll out!",2018-05-31 19:11:29
"App keeps crashing!","https://itunes.apple.com/sg/reviews/id183238319","Holsed","7.0.4","1","Forced me to upgrade the app and it crashed every single time I opened it! And I can’t do any emergency transfers! Please fix it!",2018-05-31 11:48:31
"Keep crashing","https://itunes.apple.com/sg/reviews/id281637395","yhjhoo","7.0.4","1","Always needed upgrade before using, and always crashing",2018-05-31 03:29:20
"App crashed after recent update","https://itunes.apple.com/sg/reviews/id49978021","Mayoigo","7.0.4","1","App crashed every time i tried to open it on iPhone X after the recent interface update for the past weeks. Been waiting for the patch but it didn't happen. Can SC look into it urgently? I am not able to do any transactions on my mobile at all.",2018-05-31 01:08:32
"Update but can’t launch","https://itunes.apple.com/sg/reviews/id294731796","Desmondhengnineteen88","7.0.4","1","Doesn’t bode well for confidence when the app keeps asking you to update and having done so still does not launch. This wasn’t in the middle of the night mind you. It was smack in the middle of a Saturday afternoon.",2018-05-30 03:59:02
"Crashing on iOS 11.4","https://itunes.apple.com/sg/reviews/id113471596","jeff_084","7.0.4","1","Totally unable to launch the app, it just keep crashing.",2018-05-30 03:07:12
"Incompatible with iOS 9.3.5","https://itunes.apple.com/sg/reviews/id251908872","Yuhui BC","7.0.4","1","Contrary to the specification about the compatibility, this app does not even start on iOS 9.3.5. Meanwhile, the video in the loading screen does nothing except use up battery power.",2018-05-30 00:25:19
"Unstable","https://itunes.apple.com/sg/reviews/id115347969","rhufn","7.0.4","1","App keeps crashing!",2018-05-29 15:57:13
"Update and account blocked/cant open","https://itunes.apple.com/sg/reviews/id100208149","Sleek181","7.0.4","1","Team working on this should be fired. I updated my account and got blocked. Spent an hour with call centre resetting my account.",2018-05-29 10:13:12
"stuck and angry","https://itunes.apple.com/sg/reviews/id287355813","jj221234567890","7.0.4","1","your app does not work and shows visual that does nothing!! very upset and angry😡😡😡",2018-05-29 07:21:30
"Unable to use app","https://itunes.apple.com/sg/reviews/id589005153","disappoinyed","7.0.3","1","Kept asking me to upgrade to new version which already upgraded.. I can’t use the app at all now..",2018-05-29 04:39:29
"Don’t understand","https://itunes.apple.com/sg/reviews/id154274927","Xiuu","7.0.3","1","I updated the app but it still kept on asking me to update the app before it lets me use it. I don’t understand",2018-05-28 15:41:45
"Currency converted amount details at mobile app missing","https://itunes.apple.com/sg/reviews/id124117368","AppDyno","7.0.4","2","Hi, I used to be able to see the converted currency details in the past. The new app is not showing the details. I strongly suggest the bank to improve and make it better rather than make it worst user experience with new app version.",2018-05-28 15:28:36
"latest update keeps crashing","https://itunes.apple.com/sg/reviews/id179009244","Dp1407","7.0.4","1","i do one transaction and the app crashes... i had 7 crashes in the last 5 mins while using it... clearly not an improvement this update. 
The app itself is good. if it works;)",2018-05-28 05:56:54
"Poor interface and setup","https://itunes.apple.com/sg/reviews/id155023655","gw007sg","7.0.4","1","Frustrating layout and UI... I keep getting logged out of my banking when on the website as I have to go to my phone to get an OTP, but then face recognition on the iPhone X kicks in which logs me into the phone app and then out of the website... way behind DBS offering which is much slicker",2018-05-28 05:36:33
"App crashes","https://itunes.apple.com/sg/reviews/id270211068","mark.isaiah","7.0.4","2","After the latest update, the app crashes each time I view the Ac balances via the new shortcut on the main page.",2018-05-28 05:14:25
"Apps is dead","https://itunes.apple.com/sg/reviews/id149457618","GinLeTz","7.0.3","1","Prompt me to update. But there isn’t anything to update as I had already updated. Can’t use the app at all.",2018-05-28 02:17:51
"Finger print error","https://itunes.apple.com/sg/reviews/id131526994","ssh27","7.0.4","2","After upgrade my finger print log in not working",2018-05-27 17:05:01
"App Crashed","https://itunes.apple.com/sg/reviews/id354432827","jiesiminsi","7.0.4","1","The app has been crashing since the last update on iOS 11.3.1. Please do something about it",2018-05-27 15:05:19
"Very bad online banking experience","https://itunes.apple.com/sg/reviews/id203623734","kay lauren","7.0.4","1","I like the previous app interface, it is more user-friendly than this new update, i was proud to have an SC account before i even told my sister and friends that it is very easy to use but now aside from very hard to find atms, online banking also get very hard to use so i may switch to other banks soon",2018-05-27 13:55:08
"BAD","https://itunes.apple.com/sg/reviews/id104830854","Roxas725619925","7.0.3","1","Already upgraded and still prompt me to upgrade app -.-",2018-05-27 12:12:32
"Upgraded but not able to use the app","https://itunes.apple.com/sg/reviews/id149228423","Dennis Loi","7.0.4","1","The app has been upgraded on 27th May , go to app store and then click open app , says upgrade , then after that can’t log in again .",2018-05-27 05:55:03
"The best App ever ❤️","https://itunes.apple.com/sg/reviews/id570315575","Cynthia Beauty Lashes","7.0.4","5","Really save time for ppl who always need to do transaction online. Good Job and thanks for what you have done for us.",2018-05-27 04:57:42
"Worst move by SC to date","https://itunes.apple.com/sg/reviews/id220673865","Ravemaster16","7.0.3","1","Stupid move by SC to require installing an app to do simple tasks! Listen SC... I DO NOT WANT A BANKING APP ON MY PHONE. Just let me bank in peace without your stupid app pleaseeee. It's one thing to register a mobile number for OTP, but it's pure stupidity to require an obsolete 100MB app installed on my limited-space phone just to access my online banking page and make transactions on my desktop.",2018-05-27 04:46:15
"SC mobile key","https://itunes.apple.com/sg/reviews/id149980757","Jessicasxw","7.0.3","1","It has been fine until it calls to download the SC mobile key. It takes forever to register so I closed it. I tried to load the app then it crashes and I cannot enter. Must delete the app & download again before I can log in. Pls look into this issue & fix it ASAP.",2018-05-26 08:01:56
"Still unable to register for mobile token","https://itunes.apple.com/sg/reviews/id202164541","Shenevie","7.0.3","1","Still unable to register for mobile token! Please fix it before the due date.",2018-05-26 07:21:58
"Horrible app","https://itunes.apple.com/sg/reviews/id561270301","Aaisn123","7.0.3","1","New updates are so buggy, keyboard keeps popping up when pressing any button but you can't use it for input",2018-05-24 23:15:39
"Crash to Screen","https://itunes.apple.com/sg/reviews/id478722006","seobgbab","7.0.3","1","Badly built app. Ever since the new update it just doesn’t open up at all & crashes back to the iPhone main screen.",2018-05-24 08:37:46
"App is not working","https://itunes.apple.com/sg/reviews/id333391645","heifbckxjs","7.0.3","1","The app does not work in iOS 11.3.1",2018-05-24 01:32:01
"Please do something.","https://itunes.apple.com/sg/reviews/id107670994","Lucky_goldfish","7.0.3","1","Not stable. Always crush.",2018-05-22 06:40:59
"Wipe and view option","https://itunes.apple.com/sg/reviews/id542859600","hazecabz","7.0.3","2","It would be better if they have a ""swipe and view"" option instead of logging in just to check your balance. It is more convenient that way. Otherwise, app is okay.",2018-05-20 22:39:53
"Improvements needed","https://itunes.apple.com/sg/reviews/id209062465","Rani2007","7.0.3","2","I compare this to the DBS ibanking app which gives a better user experience. SCB, you need to step up!!

1) Pls break up the credit card transactions per billing period, so that i can tell at a glance without having to log in to the website to download my estatement! Or alternatively, allow me to view my estatements from the app!!

2) For transactions, pls indicate the foreign amount AND equivalent Sgd amount. Right now, i still have to go to sc website to download estatement and be able to see this info 🙄

3) Speaking of website, after opening statement of one billing period, i have to log in all over again to view another month!?! At least open the statement in another tab so that i can seamlessly open another one. I use my smartphone to do all these, so pls improve the experience for mobile users!!",2018-05-19 18:50:07
"FaceID doesn't work","https://itunes.apple.com/sg/reviews/id193211071","user275184","7.0.3","1","New version doesn't handle face ID on IPHONE X. And can't paste my secure password into the box either. So I need to set a short and insecure password to use this?
And app support link doesn't connect. Total incompetence",2018-05-16 04:19:47
"App crashes all the time","https://itunes.apple.com/sg/reviews/id117991984","Vespadiver","7.0.3","1","After the upgrade to using the mobile phone as token, the app crashes every time logging in.",2018-05-14 09:18:49
"Crash","https://itunes.apple.com/sg/reviews/id145287656","William Lou","7.0.3","1","Always crash when I opened for this update!!! Please fix",2018-05-14 08:20:08
"SC Mobile Key","https://itunes.apple.com/sg/reviews/id106315956","scb-user","7.0.3","1","The app clashes each time I attempt to add the new feature. Afterwhich, the app cannot even be launched. Pls look into it. Thanks.",2018-05-11 05:14:11
"2 new update fails","https://itunes.apple.com/sg/reviews/id176045493","Hush12345679","7.0.3","1","After 2 new updates the app crashes!! I cannot load it",2018-05-10 15:50:55
"Crash","https://itunes.apple.com/sg/reviews/id149414842","shoo101","7.0.1","1","Uninstall and install again. But still crash. Please fix asap",2018-05-09 14:46:48
"Crash","https://itunes.apple.com/sg/reviews/id149318793","tt223","7.0.1","1","After registering for the new app interface, it crash. Thought it should have improved from the previous version. Please wake up. 👎",2018-05-08 13:16:37
"SC mobile Singapore","https://itunes.apple.com/sg/reviews/id162743971","support the GC","7.0.1","1","Really bad ; not even able to log in ..with OTP sent to sign in ; and after asking for pin to set up n register icon non stop",2018-05-05 08:22:34
"Very nice","https://itunes.apple.com/sg/reviews/id106825378","Kamsky of Sengkamg","7.0.1","5","And triple wow. The new features are  life saver. Tired of poking and squinting my eyes and adjusting angles just to read the digits shown in card token. Digital key is amazing.",2018-05-04 15:54:16
"App keeps crashing","https://itunes.apple.com/sg/reviews/id85337727","Blurmich","7.0.1","1","Can’t open the app, keeps crashing..",2018-05-04 15:47:34
"Worst banking app","https://itunes.apple.com/sg/reviews/id105323482","tuy21","7.0.1","1","Ridiculously annoying when the app crashes on you every time you try to run the app. This app is absolutely time wasting and doesn’t help at all!",2018-05-04 03:46:18
"Great!","https://itunes.apple.com/sg/reviews/id113000906","Cheerbabyey","7.0.1","5","A little buggy at times but the latest version  7.0 works well and has great UI",2018-05-02 00:01:49
"Keep prompting for key","https://itunes.apple.com/sg/reviews/id103981194","Jukey200909","7.0.1","1","Can’t use any of the functions now. Fix it.",2018-05-01 16:36:03
"Lousy user interface","https://itunes.apple.com/sg/reviews/id111274210","friendsbyfate","7.0.1","1","This application is so difficult to use.",2018-05-01 10:41:58
"App keeps shutting down","https://itunes.apple.com/sg/reviews/id299570387","Olliechiny","7.0.1","1","Impossible for me to start the app as it blacks out once i enter it. Please resolve this problem",2018-05-01 05:30:03
"Cant even log in","https://itunes.apple.com/sg/reviews/id125421933","callmelyn","7.0.1","1","After the recent update i cant even log in",2018-05-01 04:34:04
"Lousy new APP","https://itunes.apple.com/sg/reviews/id154900901","Duchess Ivy","7.0.1","1","Just tried to register n it just hangs there.
Now I cant go into the Banking App at all. It opens n go off. Open n go off. Very unstable.",2018-04-30 17:29:05
"Keeps Logging Out","https://itunes.apple.com/sg/reviews/id189893300","Hyped2max","7.0.1","2","I do appreciate the move towards an app-based OTP instead of the use of tokens. 
However the app does keep logging off after a couple of actions, be it approving a log-on or a new payer etc. 

After I have been away for a while it may also prompt that the device configuration has changed and require a mobile key registration again. This, while I am certain that I did not change any of the app configuration. 

Also, when authorising a new payee or transfer, I need to prompt the system via my PC browser twice before I get to the mobile key screen on my app. A minor bugbear but it should be sorted out.",2018-04-29 08:39:29
"Infinity update","https://itunes.apple.com/sg/reviews/id147308180","Asap5","6.6.21","1","The scb app is up to date in my phone. Still keep asking to update.",2018-04-27 13:00:56
"Update has made it worse","https://itunes.apple.com/sg/reviews/id423636920","Vigindian","7.0.1","1","25-Apr-2018

After the update, I'm unable to see my CC transactions anymore. Every time I click on my card, it keeps asking for my PIN and comes back to the main page. Disappointing!",2018-04-26 12:37:57
"I like the revamped version","https://itunes.apple.com/sg/reviews/id424121121","Toh Leng Wee","7.0.1","5","Well done, the revamped version is totally new from the old version. I like the interface.",2018-04-25 15:50:23
