"Title","Author_URL","Author_Name","App_Version","Rating","Review","Date"
"Worst possible UI","https://itunes.apple.com/sg/reviews/id154617586","Singularity-Kerr","6.6.21","1","I will pay to meet the genius who designed the UI and give them a piece of my mind. I’m no UI designer myself but it looks downright horrible compared to any app from the competition.
We are talking about a bank which has tonnes of resources to develop a decent app; but no, they will keep those dollars for their fat bonus packages.
I might switch back to DBS just because of this horrible app of SC.",2018-04-25 03:58:53
"It just works","https://itunes.apple.com/sg/reviews/id127014227","BlackSwan_02","7.0.1","5","Not sure what all the fuss is about
The app works well 
Haven’t had any issues on my iPhone X, even previously on my iPhone 7
I would suggest all to update to the latest version and also to keep you iPhone up to date. People are complying about not being able to see the due date and no reminder. This is your responsibility. If you don’t pay your bills on time, that your fault, not the bank. Paperless, yes, save the damn earth, one little step at a time.",2018-04-24 12:53:33
"3.5 stars tbf, decent after update","https://itunes.apple.com/sg/reviews/id459412689","Chaosdingo","7.0.1","4","Oh yes finally moving on with the times. (Size 48 fonts anyone? Lol)

Pretty impressive UI although I question the need to see your records without logging in. It's a fancy feature if you have nothing much better to update already but compared to the fact that until today statements are still hidden instead of being easily accessible (maybe see how citi does it?), this should have been wayyyyyy below the to-do list.

Also the confirmation bar is the old one! Very ugly la Aiyo. Nonetheless, keep moving towards this direction and I'm sure you guys will catchup with the top dogs soon. Until then, 3.5 stars!",2018-04-24 11:47:16
"Refreshing!","https://itunes.apple.com/sg/reviews/id185187178","Yogendra Rampuria","7.0.1","4","Amazing updates! Mobile Key, Lite mode up front!",2018-04-23 13:15:09
"SC Mobile","https://itunes.apple.com/sg/reviews/id120170712","Sobakawa","7.0.1","5","Awesome app! Very intuitive! No longer do I need the Hard Token. Kudos to the team who developed this!",2018-04-23 11:54:36
"Foreign currency transactions","https://itunes.apple.com/sg/reviews/id335689605","Dreamliner 777","6.6.21","1","What’s the use of displaying just the foreign amounts and not together with the SGD equivalent in the card transactions history? 

Please fix this.",2018-04-23 08:00:17
"Very bad UI for iPhone 7 Plus","https://itunes.apple.com/sg/reviews/id661504326","kumarmugu","6.6.21","1","Very bad UI for iPhone 7 Plus",2018-04-18 04:23:33
"Poor user interface","https://itunes.apple.com/sg/reviews/id113100999","decision4","6.6.21","1","Probably the last bank to not optimize for iPhone X",2018-04-16 09:42:23
"No support for iPhone X resolution","https://itunes.apple.com/sg/reviews/id116426871","adrianteo","6.6.21","1","Quite possibly the only banking app that’s way behind the curve in incorporating support for iPhone X’s native resolution. Deplorable.",2018-04-15 15:54:04
"App login","https://itunes.apple.com/sg/reviews/id149643611","KillerjasonX","6.6.20","1","I always have this problem login, everytime I do that it’s will how no WiFi connectivity and etc which does not allows me to login app developer of SC please look into it as it’s giving not just me i suppose in using the app",2018-04-15 05:00:53
"The worst","https://itunes.apple.com/sg/reviews/id114502945","bastjanlee","6.6.20","1","Please update your UI for iPhone X",2018-03-26 17:53:12
"This app is a joke","https://itunes.apple.com/sg/reviews/id373649171","Mpnitin","6.6.20","1","Seriously ? What’s this ? It’s so choppy. Can’t you guys build a native app ?",2018-03-26 09:40:25
"UI","https://itunes.apple.com/sg/reviews/id208361130","Chee Nam","6.6.19","1","Please revised apps resolution based on iPhone 7plus. When i tap in to SC Mobile Apps, my screen goes to low resolutions, the suddenly changes make me confuse on using on apps.",2018-03-22 11:56:17
"Easiest platform to use compared to other banks","https://itunes.apple.com/sg/reviews/id199303515","Bran ong","6.6.19","5","Keep it up",2018-03-02 05:29:15
"Lazy lazy developers 😴😴","https://itunes.apple.com/sg/reviews/id199746493","AndyUk8888","6.6.19","1","Fix the screen resolution on iPhones please!!!! Large font using half the screen, hello, iPhone 5 screen was many many years ago.",2018-02-04 02:54:58
"Keep loading can’t load","https://itunes.apple.com/sg/reviews/id207456579","Pdm172","6.6.18","1","Please check.",2018-02-03 23:41:00
"Please update app to improve UX!","https://itunes.apple.com/sg/reviews/id117323241","UnknownX03","6.6.18","1","Doesnt work on iphone x

Just stays on the loading screen!!",2018-01-31 13:39:26
"Resolution","https://itunes.apple.com/sg/reviews/id112977885","M1ngda","6.6.18","2","You do update to support Face ID on iPhone X, can do one step more to support the resolution as well? The UI appears so bulky and ugly now...",2018-01-25 15:21:11
"Cannot load.","https://itunes.apple.com/sg/reviews/id159218346","marxluss","6.6.18","1","It does not work.",2018-01-23 13:37:59
"Bad ... really bad ... waste my time installing","https://itunes.apple.com/sg/reviews/id183976398","dogmastervince","6.6.17","1","I read all the negative reviews, couldn’t believe it installed on iphone 6S+, was only greeted by the “Welcome to SC Mobile Banking formally  Breeze Mobile” ... waited for 3 min... still the same screen !!! Uninstalled within 5min after installation!!! Still have some faith, installed on iPhone 5, same fate!!! Totally disappointed with SC putting up such inferior mobile app despite the negative feedback!",2018-01-23 06:20:18
"Ridiculous compared to the competition","https://itunes.apple.com/sg/reviews/id357937977","Dca2992","6.6.17","1","I hope someone from SCB is reading this. This app was great when it was first launched, now it’s just feels slow
The transfer interface is on a separate interface now which slows down the selection of accounts and therefore the whole process of transferring funds.

In addition, after several months of the IPhone X launch, SCB is still unable to fully utilize the full screen capabilities of the iPhone X.

If every other bank in the street is able to update their app timely and to provide a seamless transfer of funds interface. Why can’t SCB??? I not asking for you to top the competition, but please, just at least follow the pack.",2018-01-15 16:00:11
"Very Disappointing","https://itunes.apple.com/sg/reviews/id149510219","sudheer118","6.6.17","1","Poor UI Quality
still waiting for iPhone X resolution support.",2018-01-07 09:14:15
"Waste time apps","https://itunes.apple.com/sg/reviews/id123989400","Erikahra","6.6.16","1","- can’t check history.
- transaction not accurate at all.
- fail user interface.
Basically an app that doesn’t work. 
Those who give 5 starts review Most likely is developer team themself...",2018-01-07 02:24:40
"iPhone X","https://itunes.apple.com/sg/reviews/id678075335","Emata+++","6.6.15","1","Doesn’t work on iPhone X",2017-12-21 12:51:36
"Bad UI","https://itunes.apple.com/sg/reviews/id195858244","M@'(","6.6.16","2","Multiple empty updates to add “FaceID” which has been working since day 1?

Badly optimised for iPhone 6 and above, font size and interface overly large. Designed for an aging population or what?

Still not optimised for iPhone X screen after 2 months despite multiple updates which change nothing.

To and From fields should be swapped in funds transfer. No other bank does it this way around.",2017-12-16 05:51:51
"iPhone X resolution please.","https://itunes.apple.com/sg/reviews/id478121351","JustGivingReviews","6.6.16","3","Please update the app so it’s full screen on iPhone X and thanks for Face ID! Though it worked just fine haha

So many updates but doesn’t cater to the X resolution",2017-12-16 05:06:25
"Lousy apps that keep detecting me iPhone as jailbroken but it's not","https://itunes.apple.com/sg/reviews/id153632739","Reviewermap","6.6.15","1","The app keep saying it detect my iPhone is jailbroken and prevented me from using but the phone was not jailbroken at all. Now I can't even use it at all. Stupid",2017-12-16 02:35:16
"Lack of iPhone X support","https://itunes.apple.com/sg/reviews/id299308153","Fellowes1","6.6.15","1","The user interface still still not optimised for iPhone X, come on, even DBS and OCBC updated their app to fully support iPhone X display resolution in full screen.",2017-12-13 09:32:58
