"Title","Author_URL","Author_Name","App_Version","Rating","Review","Date"
"Zero should be Grey, not Red.","https://itunes.apple.com/sg/reviews/id119192521","pikachu's friend","7.1.5","3","I quite enjoy using SC mobile app but I am sure there are many ways to improve further. One suggestion: the color of the figures should be grey instead of red when the figure is zero. Because red signify there is outstanding but when it is zero, why is it red?? Just a humble suggestion.",2018-10-24 00:49:56
"Card details should be made more accessible!","https://itunes.apple.com/sg/reviews/id123450042","msTough","7.1.5","1","Can we just agree that the card detail that requires so many clicks to access just simply does not make any sense???

It has all the important info we need to check from time to time, such as, 1.Available limit, 2. Payment due date etc. Do we really need to click into the transaction history of the card before we can check all the info regarding the card details? Can we not make the button accessible right beside the card after login?",2018-10-20 06:28:53
"Problem after update","https://itunes.apple.com/sg/reviews/id338816458","NLS3333","7.1.5","1","Don’t receive the “approve” after updated to the latest version, was not able to retrieve e-statement for payment!",2018-10-18 14:47:04
"Why forcing to update?","https://itunes.apple.com/sg/reviews/id85706585","From Vietnam","7.1.5","1","Opened the app just to get the PIN and forced to update the app. Did not have internet connection so could not do anything.",2018-10-16 07:24:52
"Difficult to use OTP","https://itunes.apple.com/sg/reviews/id141715984","ajraldev","7.1.5","1","A bank with good service but need to upgrade the app, especially for iPhone. I can’t see the OTP after login as the message is long and does not fully display to take note of the number. So when I try to copy the OTP number from the message and then try to paste it, the app gets reset and need to log in again!",2018-10-16 03:37:10
"Totally awful","https://itunes.apple.com/sg/reviews/id127764294","scscscscscscscscscscscscsc","7.1.5","1","Someone must experience other banks or retailers’ app experience. Worst!!! E.g., App update should not be a default step to sign off online bank in computer. Such a simple thing makes a big difference in user experience!",2018-10-15 18:12:20
"Face recognition","https://itunes.apple.com/sg/reviews/id141832256","AnDongNi1963","7.1.5","2","Still no face recognition except Touch ID. I cannot even disable Touch ID now.",2018-10-15 13:08:48
"It is a dud","https://itunes.apple.com/sg/reviews/id920448713","dontwanttopublish","7.1.5","1","I don’t want to use worst to describe this app. It is a dud absolutely. Without any consideration of what users will suffer from it. Today again, you need a code to deal with but the app not allow you to approve. The only reason is force you to upgrade silly functions I am not interested at all. Why you release a half cooked dud and forbid to use the tokens at the very begging and after this can work finally. You made another bug to disturb your customers.",2018-10-15 04:52:49
"Bug in latest version","https://itunes.apple.com/sg/reviews/id158727162","Juser3","7.1.4","1","Updated to latest version but cannot login, keep asking me to upgrade to the latest version but it is already the latest version",2018-10-15 04:02:51
"Forced to update app","https://itunes.apple.com/sg/reviews/id42685002","jjlinonitunes","7.1.5","1","I’m just trying to log in but now I’ve to update my app before I can do anything.",2018-10-15 03:33:37
"Cannot open the app","https://itunes.apple.com/sg/reviews/id102102867","jaclinechua","7.1.4","1","When I tried to launch the app, it keep on showing me “upgrade now” and when I click that button to the App Store, it shows “open” which means the app already upgraded. So it is a vicious cycle that I can NEVER open the app! Help !!!",2018-10-15 02:01:07
"Showing update option","https://itunes.apple.com/sg/reviews/id180280367","San2913","7.1.4","1","Even though I have updated the app but still seeing update option on login screen.
This is so annoying.... force update and then this option doesn’t disappear even the app the updated",2018-10-14 12:18:09
"Let me use the app","https://itunes.apple.com/sg/reviews/id458715192","Zihui4937294","7.1.4","1","If there's no update on the App Store, stop directing me to the App Store",2018-10-14 05:24:08
"Please don’t force to update app","https://itunes.apple.com/sg/reviews/id87284764","ios user since 2008","7.1.5","4","Please don’t force to update app. The update haven’t shown up and the app was unusable",2018-10-14 03:29:49
"Updating the app blocks it","https://itunes.apple.com/sg/reviews/id185957738","ksellesl","7.1.4","1","SCB prompts me to update the app, in AppStore it’s update but when opening the app it still shows the prompt, so I cannot use the app",2018-10-14 02:15:53
"Face ID is not working at all","https://itunes.apple.com/sg/reviews/id104246631","eViLz.Inc","7.1.5","1","When I was using Touch ID on the older iPhones, it works flawlessly. Now I switch to the new no button iPhone, using Face ID even though I got a tick meaning face is verified, before the tick comes out, it says verification failed or something similar. Always have to key in username and password to Mobile banking. Very irritating and frustrating. Other banking apps are already compatible with Face ID so what is standard chartered doing?",2018-10-11 23:39:40
"Face ID","https://itunes.apple.com/sg/reviews/id144361822","Wendyngsh","7.1.5","1","Pls update your app to allow Face ID",2018-10-11 16:36:40
"Pretty starting screen","https://itunes.apple.com/sg/reviews/id917878157","auhnu","7.1.4","1","The opening screen is pretty, but that as far as I manage to get on the app as it always hangs there",2018-10-10 04:41:05
"A big fat joke","https://itunes.apple.com/sg/reviews/id190949195","Panda panda 3","7.1.4","1","App is not working at all. I cannot do any banking transaction (without logging into the mobile app), which is not working! The app just launch and hangs. No error message, no prompts, no nothing! Can the development team actually do some testing before pushing out the updates!",2018-10-09 06:40:30
"Sae your time, choose another bank","https://itunes.apple.com/sg/reviews/id176375430","right2e","7.1.4","1","OTP sms comes 2 hours late.

bank doesn't keep promises about the application promotions.

Too many complications, stay away!",2018-10-01 12:43:59
"Cannot login at all","https://itunes.apple.com/sg/reviews/id443697544","Stanleysee88","7.1.4","1","Prompt error while login, re-install also no help. I can’t register mobile key for bank transaction!!!
Error message as below
JavaScript error - TypeError - null is not an object (evaluating ‘t.isOffline’)",2018-10-01 03:46:08
"App not updated","https://itunes.apple.com/sg/reviews/id41982546","kennethwong79","7.1.4","1","I am using iPhone Xs Max and the app is still asking me for touch ID verification. When I press the button it does the face ID scan then says failure. Please update.",2018-09-30 17:16:15
"Doesn’t work mate","https://itunes.apple.com/sg/reviews/id475791638","HL Lee23","7.1.4","1","The app doesn’t work.",2018-09-30 06:05:50
"Not supporting Face ID","https://itunes.apple.com/sg/reviews/id157322415","brynchng","7.1.4","3","The app is not supporting Face ID as login method.",2018-09-30 02:31:19
"Transaction showing unsuccessful, but deduct the amount from my account","https://itunes.apple.com/sg/reviews/id496719355","Vincentcho87","7.1.3","1","I used their mobile apps to do an online transaction to a merchant, the apps showed me transaction unsuccessful but I receive a message show that amount have been deducted from my account. Then I call in to customer service, and they said they can’t do anything to solve the issue. What kind of service and what kind of lousy Apps SC has developed.",2018-09-27 01:48:13
"Doesn’t work!","https://itunes.apple.com/sg/reviews/id171270755","Zenadora","7.1.3","1","App keeps prompting JavaScript error when trying to login.",2018-09-26 08:24:05
"Accounts on the mobile app do not tally","https://itunes.apple.com/sg/reviews/id480121043","hermajordoctor","7.1.2","1","The app doesn’t reflect actual statement balances, it shows up right in the online banking or from purchasing power in the trading app, but not in the mobile app.

Makes you wonder about the quality, consistency and stability of their whole banking platform...",2018-09-24 16:46:21
"No support for Face ID","https://itunes.apple.com/sg/reviews/id114708919","Alex Wong阿力士","7.1.2","1","Possible to add in Face ID support for this apps?",2018-09-23 23:19:58
"iPhone XS MAX","https://itunes.apple.com/sg/reviews/id395850609","gouw_b","7.1.2","5","The app shows Touch ID instead of Face ID. Uninstalled and reinstalled a few times, never solve the issue. Please kindly update",2018-09-22 08:23:45
"Good app","https://itunes.apple.com/sg/reviews/id872793206","dameww","7.1.2","5","Simple and easy to use. SC MOBILE KEY is very convenient.",2018-09-18 17:00:14
"Keeps crashing every time I click login.","https://itunes.apple.com/sg/reviews/id160236481","taoyogi","7.1.2","2","Keeps crashing every time I click login. Could not evaluate JavaScript error - what a waste of time.",2018-09-10 12:34:39
"Cannot register for internet banking token at all!","https://itunes.apple.com/sg/reviews/id136246214","Tap burn","7.1.2","1","Cannot register for mobile banking at all!
Why link the internet token to an app.
Can’t even register for it through this app.
Can’t transfer money.",2018-09-06 12:39:19
"Apps not robust","https://itunes.apple.com/sg/reviews/id264125040","wayan 23","7.1.1","1","When one tried to enable the sent notification, it spin forever & cannot get out from the apps. If that is the case how can one be sure that system is secured & robust since it freeze & one cannot logon.",2018-09-04 17:23:14
"7.1.1 blocks jailbreaks.","https://itunes.apple.com/sg/reviews/id136860799","Uberex","7.1.0","2","FYI jail breakers.",2018-09-02 04:33:55
"Suggestions","https://itunes.apple.com/sg/reviews/id100866097","Sallywhy","7.1.1","3","Was automatically converted to receiving electronic statements instead of my usual paper statements for a few months now.

1) had a hard time submitting claims to my company for specific monthly spendings. Reason being my name did not appear together with the transaction(s). Tried both app and web version of statements but both versions did not list my name together with the transaction. Will be unable to submit my claims without this. Please change this and fast. Else i’d be forced to use the service of other banks instead.

2) Had a really difficult time searching through the app just to view my monthly statements. Suggest to make this easier if you want us users to stick with using electronic statements.

3) 60 days worth of transaction history is totally insufficient. Hope it will get increased to 12 months, or the bare minimum of 6 months.

4) option to receive paper or electronic monthly statements.
This option was not included in your app. Hope it will get included in your new version.

Thanks.",2018-08-31 08:55:23
"I cannot log in!","https://itunes.apple.com/sg/reviews/id307267698","Danoobsama","7.1.1","1","I cannot recall this bug existed but it has been quite some time since I was able to login to the app and view my finances or make any transactions (through the app). This is very inconvenient especially pple on the move and all the more unstable when you factor in the app’s role in authenticating the login from the web.
Able to expedite this fix? Anyone facing a similar problem, those using iPhone 10 with the latest OS?",2018-08-29 06:25:38
"Please update the app with Face ID function ASAP","https://itunes.apple.com/sg/reviews/id212655235","Alice_MLL","7.1.1","2","Ever since I changed my phone to iPhone X I have to literally key in my account ID and password every time I login! This is so annoying!!!!

Please update the app with Face ID ASAP!!!",2018-08-29 05:00:00
"is this a glitch?","https://itunes.apple.com/sg/reviews/id175877265","Fangism","7.1.1","2","I have been trying to log into the app with my user id but it says device registered under another user. But i can log in through Safari. Why?",2018-08-27 15:57:50
"Frustrating app","https://itunes.apple.com/sg/reviews/id128846906","F3ustrated","7.1.1","1","Doesnt work even after calling and reloading twice. 
Since this is the only mobile authenticating key, 
No way to do online banking so expect fines for overdue payments since I can’t access my cash. 
Wasted 1 hour already trying to log in. 
Reloaded app showed the ‘approve’ notification, but after clicking it - the online banking doesn’t register it and its back to square one. 

Even posting this is a problem. All unhappy words for nicknames have been taken.",2018-08-25 04:05:55
"Crashing for the new update","https://itunes.apple.com/sg/reviews/id132275115","Xiao dou dou","7.1.1","1","The latest update keep crashing on my iPhone.",2018-08-20 09:06:29
"Best ever Banking app to use without holding any token , card or sms verification","https://itunes.apple.com/sg/reviews/id599787514","Shweo82","7.1.1","5","One of the best banking app 
Never fail me except maintenance time 
User friendly 
First ever all cards to pay which is one of the reason I chose to use years back 
Impressive layout and feature 
Upgrading to be better",2018-08-14 14:10:51
"SC new app","https://itunes.apple.com/sg/reviews/id664676106","masethung","7.1.1","5","Easy to access.. better than older version... able to view transactions immediately...transaction data  update really awesome...",2018-08-14 05:50:00
"Super Excellent App :)","https://itunes.apple.com/sg/reviews/id870015467","IpogDreams","7.1.1","5","I love the new app. Excellent user experience and beautiful UI, easy to use. Cool Pre-Login, Soft token, Touch ID features are mind blowing.. Kudos to the dean who developed this app. Great work guys!",2018-08-14 04:54:13
"Upgrading & Upgrading & Upgrading...still the same","https://itunes.apple.com/sg/reviews/id424337526","D8023","7.1.1","1","Always upgrading in the middle of the day where people need to use the app. If it is so essential to do upgrading work consider doing it later of the night. Encounter the upgrading numerous times in the middle of the day. Eventually after upgrading still the same. Is security even better?",2018-08-14 04:05:52
"Crash and crash and crash","https://itunes.apple.com/sg/reviews/id149872794","Sgboy82","7.1.1","1","Terrible.",2018-08-14 01:45:41
"Good app with great visuals","https://itunes.apple.com/sg/reviews/id872793431","0692ty","7.1.1","5","SC mobile key provided great convenience in all my banking transactions",2018-08-12 15:40:41
"Positive Experience","https://itunes.apple.com/sg/reviews/id655202539","EChongy","7.1.0","5","Positive experience with the mobile app. User friendly app that helped me in getting all my banking errands done. No longer need to visit the branch. Doesn’t require me to keep a token as they have finger print authentication.",2018-08-12 13:55:22
"Terrible user experience","https://itunes.apple.com/sg/reviews/id178747859","sputnikstar","7.1.0","1","I am disappointed with this app. It’s hard trying to log in on my iPad....had the app open on my registered device (mobile) to approve the login request via my ipad, and no approval request came through on my mobile despite resending the approval notification several times. The previous app was far better in terms of user experience.",2018-08-12 10:15:38
"Awesome App","https://itunes.apple.com/sg/reviews/id441593730","Antony Selva","7.1.0","5","SC Mobile has been greatly improved with new interface. SC Mobile Key has made login a Breeze by removing manual otp.",2018-08-12 08:12:53
"Buggy PayNow keep asking for SC Mobile Key","https://itunes.apple.com/sg/reviews/id169228611","Joejoh","7.1.0","2","Please fix this sub-application as I cannot use PayNow service now. Despite receiving SMS OTP, the app ended up with a blank screen and no response. How to use PayNow service like that?",2018-08-08 09:02:01
"App hangs regularly","https://itunes.apple.com/sg/reviews/id587734991","sgngek","7.1.0","2","The app hangs regularly. Need to delete n download again n redo the settings.",2018-08-05 01:52:16
"Worst ever","https://itunes.apple.com/sg/reviews/id204738500","一克咖啡豆","7.1.0","1","Unable to view details on the app after log in! Have to open browser to view details! Please rectify",2018-08-02 10:08:42
"Break right after for update.","https://itunes.apple.com/sg/reviews/id123975116","Victorco1","7.1.0","1","Ya right. Moving to virtual token to save money for your SMSes but your virtual token doesn't even work. What the point. I rather stick with physical token then. 

To add, The screen moves so? Does it give any advantage?",2018-08-01 04:10:29
"VinayDixit","https://itunes.apple.com/sg/reviews/id483340394","vinaydixit","7.1.0","5","This is an excellent banking application I have ever used.",2018-07-31 13:37:53
"Completely unusable after update","https://itunes.apple.com/sg/reviews/id214498964","V9911","7.1.0","1","After the update, can't perform key functions like transfer between own accounts, see own payment and transaction history. When transferring between own account, even though all fields are filled, the ""Next"" button is still disabled with no hints indicating what I did wrong. A complete empty payment and transaction history when obviously there are. I would prefer there be no updates then to see core functions breaking like this.",2018-07-31 06:48:50
"One of best Mobile Banking Apps out there","https://itunes.apple.com/sg/reviews/id143494808","Sudhir India Panda","7.1.0","5","I have a lot of bank accounts across multiple countries and this is one of the most intuitive apps out there with gorgeous album art and simplistic functions interface.",2018-07-30 05:08:52
"Best banking app ever!","https://itunes.apple.com/sg/reviews/id106032923","CLEK446","7.1.0","5","Banking is less boring now with SC Mobile. I especially like the personalization functionality within the app.",2018-07-30 04:26:37
"Feature","https://itunes.apple.com/sg/reviews/id247821139","Arun305","7.1.0","5","Need capability to modify scheduled payments",2018-07-27 06:02:42
"Very good banking app","https://itunes.apple.com/sg/reviews/id8385246","dazsnow","7.1.0","4","The UI is much better than it used to be and authentication is much easier than in most other banking apps. Quick access to balances and transaction history is super handy, as well as the push notifications. You can do everything you might need to straight from the app - make payments, block and replace your cards, instantly reset your PIN, etc. 

After logging in the menu structure is strange though - no section for cards... ?? 2 separate sections for payments and transfers is very confusing as a customer - which means most of those great features are buried and hard to find. The payment flow is clunky, and everything is slow to load.",2018-07-27 05:13:45
"Great App","https://itunes.apple.com/sg/reviews/id162658746","Nit@b","7.1.0","5","Great App and amazing experience.
Loved the new personalised version with good graphics , personalised and changes with time of day ..",2018-07-27 04:52:40
"Good improvement","https://itunes.apple.com/sg/reviews/id871217551","singaporean12345","7.1.0","5","The recent change to the app is a good innovation and allows me to add layers without the token. Good job!",2018-07-27 04:40:57
"Excellent App","https://itunes.apple.com/sg/reviews/id163341142","Swami1975","7.1.0","5","Easy navigation, better control and better experience... 

I can't ask for more.",2018-07-27 04:39:39
"Great Application","https://itunes.apple.com/sg/reviews/id507094531","Arkozhiyalam1","7.1.0","5","Great mobile banking application, innovative features",2018-07-27 04:35:59
"Very intuitive and good","https://itunes.apple.com/sg/reviews/id195323771","sgroni1984","7.1.0","5","Great app!",2018-07-27 04:27:06
"Intuitive and easy to use","https://itunes.apple.com/sg/reviews/id124638039","hellotherestranger1234","7.1.0","5","Happy to find that I can set up account transfer payee directly on the mobile app and make instant transfer. Would be nice if I can change transfer limit directly on mobile too though, as I had to go to web version to change that now.",2018-07-27 04:15:49
"Brilliant User Experience","https://itunes.apple.com/sg/reviews/id871206136","Baymax08","7.1.0","5","Fantastic app, works like charm with great user experience.",2018-07-27 04:14:20
"Really bad user experience","https://itunes.apple.com/sg/reviews/id536379213","Daisy K R","7.1.0","1","The app gets stuck at the splash screen forever  with the slow moving video. This is the Worst version ever or any banking app that I've used so far.",2018-07-27 04:13:40
"The worst banking app ever","https://itunes.apple.com/sg/reviews/id666154752","ATeo60","7.1.0","1","This is the worst banking app & website I’ve ever experienced. When I registered, the information of my accounts reflected on the bank app was incomplete. I msg my RM to check & he said he could see it on his system but not reflected in my online account. Then miraculously it appear after a few days. Today I set up a new payee in my account. For 10mins I tried to transfer to new payee via Fast & it prompted that I have no such payee. I was forced to transfer via standard transfer (as that’s where the payee is reflected) which will take 2-3 days for payee to receive. Then after the standard transfer was made, I went into Fast transfer and there it was, the account is shown. I’ve never had such a Long lapse of time between creating a new payee and it showing up much later with any other banks. Who in the world wants to make Standard transfer nowadays? Why do they even have this option? Ridiculous!",2018-07-26 14:43:28
"SC Mobile key page does not load","https://itunes.apple.com/sg/reviews/id212536805","Yayaya12312","7.1.0","1","SC Mobile key page does not load. None of services work as I am unable to enter the key.",2018-07-25 14:05:33
"Key Verification page blank","https://itunes.apple.com/sg/reviews/id181446196","Enjle","7.1.0","1","After upgrading, now I can't do any transaction thru mobile app
Login is successful, can see home page
But when I want to see details or make transactions, normally there is Key Verification page which I can enter the passcode set before

But now this page showing  white blank screen, please help to solve the issue

It's so troublesome that I only can do using web login, thank you",2018-07-24 06:17:49
"Rubbish","https://itunes.apple.com/sg/reviews/id234082348","another staff member","7.0.8","1","Utter rubbish application. You need to generate a password on the mobile app in order to view online statements, but the mobile app keeps either timing out or not processing a password.

Downloaded the mobile app several times to no avail. And to imagine the people who developed this app were probably rewarded richly.",2018-07-24 03:29:19
"Excellent UI , quick to access features!","https://itunes.apple.com/sg/reviews/id311503469","Digi Lol","7.0.8","5","Well done ! The app looks pretty cool and feature rich. One touch access to balances and transactions is convenient and gives choice for customisation. The new notification hub and inbox is perfect as I don’t really have to scramble through my sms messages for tracing any notifications.

The soft token works pretty smooth and makes login and 2fa a jiffy and add to it the offline pin is only making it better.

All in all the app is a great step ahead and looking for more !!",2018-07-18 05:28:11
"Very slow like hell","https://itunes.apple.com/sg/reviews/id652721905","gfludo","7.0.8","2","The app is very slow please do something for this.

Please checkout citi bank app and learn something from it.",2018-07-18 03:11:37
"App cannot register","https://itunes.apple.com/sg/reviews/id140743319","Keegan Soh","7.0.8","1","It keep saying resgister but it never get completed. And after which, app will crash and i cannot log in",2018-07-17 13:51:38
"Technical issue..","https://itunes.apple.com/sg/reviews/id638471737","FCWS JP","7.0.8","1","Hope somebody can look into it... today my i phone 8 plus software upgrade to iOS 11.4.1..
Totally the Sc mobile apps cannot be open... there is an error message..",2018-07-14 10:41:39
"Keep having server security issue after updating iOS","https://itunes.apple.com/sg/reviews/id510613910","yijian90","7.0.8","1","Unable to login after updating iOS 11.4.1",2018-07-13 16:13:32
"Suddenly not able to login","https://itunes.apple.com/sg/reviews/id106057702","kyroschen","7.0.8","1","Keeps getting an error at the start screen - a secure connection cannot be established - and the app quits. Tried logging in from a browser but it requires authentication from the app.. which quits.. physical tokens are a thing of the past my foot.. perhaps a relationship with this bank should be what’s past..",2018-07-13 14:49:37
"App can’t be used after Latest update","https://itunes.apple.com/sg/reviews/id148391018","Prudi16","7.0.8","1","I can’t use the app at all... it just closes on its own after 1 second.",2018-07-13 14:13:26
"Clearly disappointing","https://itunes.apple.com/sg/reviews/id180260812","hittest","7.0.8","1","What a disappointment. Expect much better digital capability from StanChart. The app is not even working properly. The design is terrible. Make people wonder how can anyone design such poor quality banking app. I think the bank need to rethink and beef up its mobile banking",2018-07-13 00:22:37
